{
  "contract": 1,
  "id": "kybernos/bricks",
  "kind": "code",
  "version": "0.1.0",
  "name": {
    "en": "Bricks",
    "fr": "Bricks"
  },
  "description": {
    "en": "Brick mockups, animated brick by brick.",
    "fr": "Maquettes en briques, animées brique par brique."
  },
  "icon": "bricks",
  "family": "create",
  "author": {
    "id": "kybernos",
    "name": "Kybernos"
  },
  "license": "Apache-2.0",
  "pricing": "free",
  "package": "@local/kybernos-bricks",
  "entry": {
    "host": "index.js",
    "client": "client.js"
  },
  "requires": {
    "kybernos": ">=0.1.0"
  },
  "permissions": [
    "ui.slot:sidebar.right.pane.tab",
    "host.routes:/kybernos-bricks:write",
    "agent.tools"
  ],
  "claims": {
    "routePrefixes": [
      "/kybernos-bricks"
    ]
  },
  "help": "help.json",
  "suite": {
    "default": "on"
  }
}
