{
  "contract": 1,
  "id": "kybernos/language",
  "kind": "code",
  "version": "0.1.0",
  "name": {
    "en": "Language",
    "fr": "Langue"
  },
  "description": {
    "en": "Interface language: every ISO language, translation of Kybernos and DSH, reading direction.",
    "fr": "Langue de l’interface : toutes les langues ISO, traduction de Kybernos et de DSH, sens de lecture."
  },
  "icon": "lang",
  "family": "base",
  "author": {
    "id": "kybernos",
    "name": "Kybernos"
  },
  "license": "Apache-2.0",
  "pricing": "free",
  "package": "@local/kybernos-language",
  "entry": {
    "host": "index.js",
    "client": "client.js"
  },
  "requires": {
    "kybernos": ">=0.1.0"
  },
  "permissions": [
    "ui.slot:settings.general.item",
    "ui.slot:settings.section",
    "ui.slot:sidebar.footer.action",
    "ui.dom"
  ],
  "help": "help.json",
  "suite": {
    "default": "off"
  }
}
