{
  "contract": 1,
  "id": "kybernos/dsh-db-viewer",
  "kind": "code",
  "version": "0.1.0",
  "name": {
    "en": "Databases",
    "fr": "Bases de données"
  },
  "description": {
    "en": "Read-only SQLite viewer, with charts.",
    "fr": "Visionneuse SQLite en lecture seule, avec graphiques."
  },
  "icon": "db",
  "family": "data",
  "author": {
    "id": "kybernos",
    "name": "Kybernos"
  },
  "license": "Apache-2.0",
  "pricing": "free",
  "package": "@local/dsh-db-viewer",
  "entry": {
    "host": "index.js",
    "client": "client/client.js"
  },
  "requires": {
    "kybernos": ">=0.1.0"
  },
  "permissions": [
    "ui.slot:sidebar.right.pane.tab",
    "host.routes:/dsh-db-viewer:read",
    "fs.read:dsh-home"
  ],
  "claims": {
    "routePrefixes": [
      "/dsh-db-viewer"
    ]
  },
  "help": "help.json",
  "suite": {
    "default": "off"
  }
}
