{
  "contract": 1,
  "id": "kybernos/atlas",
  "kind": "code",
  "version": "0.1.0",
  "name": {
    "en": "Atlas",
    "fr": "Atlas"
  },
  "description": {
    "en": "A map of your workspace: projects, agent teams, skills, memory, and what is broken.",
    "fr": "La carte de ton espace : projets, Agent Teams, skills, mémoire, et ce qui est cassé."
  },
  "icon": "map",
  "family": "teams",
  "author": {
    "id": "kybernos",
    "name": "Kybernos"
  },
  "license": "Apache-2.0",
  "pricing": "free",
  "package": "@local/kybernos-atlas",
  "entry": {
    "host": "index.js",
    "client": "client.js"
  },
  "requires": {
    "kybernos": ">=0.1.0"
  },
  "permissions": [
    "ui.slot:settings.section",
    "memory.read",
    "sessions.read"
  ],
  "help": "help.json",
  "suite": {
    "default": "off"
  }
}
