{
  "contract": 1,
  "id": "kybernos/auto",
  "kind": "code",
  "version": "0.1.0",
  "name": {
    "en": "Auto Routing",
    "fr": "Routage Auto"
  },
  "description": {
    "en": "Auto routing: picks a model from your list by request class.",
    "fr": "Routage Auto : choisit un modèle de ta liste selon la classe de la demande."
  },
  "icon": "route",
  "family": "models",
  "author": {
    "id": "kybernos",
    "name": "Kybernos"
  },
  "license": "Apache-2.0",
  "pricing": "free",
  "package": "@local/kybernos-auto",
  "entry": {
    "host": "index.js",
    "client": "client.js"
  },
  "requires": {
    "kybernos": ">=0.1.0"
  },
  "permissions": [
    "ui.slot:settings.section",
    "ui.dom",
    "host.routes:/kybernos-auto:write",
    "fs.write:dsh-home",
    "net:localhost"
  ],
  "claims": {
    "routePrefixes": [
      "/kybernos-auto"
    ]
  },
  "help": "help.json",
  "suite": {
    "default": "on"
  }
}
